Date,Title,Description,Open,High,Low,Close,Volume,RSI,SMA_Short,SMA_Medium,SMA_Long
2025-05-24,Dogecoin Slides Below $0.23 but Finds Support as Buyer Demand Rebuilds,Dogecoin slid 6% amid bearish pressure but held support near $0.227. High-volume buying and investor confidence suggest a potential rebound is in play.,0.2250743,0.230297,0.2238,0.2251314,29756357.16632404,44.87900633436263,0.22925008,0.22871109800000003,
2025-05-24,"Dogecoin, Cardano’s ADA, XRP Fall 7% in Weekend Bloodbath",Market capitalization slumped 5% as traders took profits on the week-long rally ahead of the weekend.,0.2250743,0.230297,0.2238,0.2251314,29756357.16632404,44.87900633436263,0.22721418,0.22859348999999998,
2025-05-26,Dogecoin Chart Turns Ugly—This Price Could Trigger Panic,"Dogecoin is losing altitude after a month-long advance that climaxed at an intraday high of $0.259 on May 11 before momentum cracked. The memecoin is changing hands near $0.228 today, capitalising the network at roughly $34 billion and leaving it 69$ below it…",0.2250887,0.2303115,0.2225032,0.2260962,30970607.30527736,46.961730132238365,0.22527475999999996,0.22849517800000002,
2025-05-26,Dogecoin Extends Rally as Whale Accumulation Signals Growing Confidence,"The original meme coin continues its bullish momentum as global economic uncertainties push investors toward alternative assets. 
DOGE's technical structure shows a series of higher lows and higher highs, with support firmly established at $0.225 and resistan…",0.2250887,0.2303115,0.2225032,0.2260962,30970607.30527736,46.961730132238365,0.22535951999999998,0.22820044800000003,
2025-05-26,"Dogecoin Price Could Surge Further As Demand Grows, But This Trendline Holds The Key","As the market retraces from its gains from last week, the Dogecoin price has been put into a tight spot regarding the continuation of its uptrend. So far, bulls have managed to stay above $0.2, but for how long remains a mystery, especially as volume stagnate…",0.2250887,0.2303115,0.2225032,0.2260962,30970607.30527736,46.961730132238365,0.22544428,0.22790571799999998,
2025-05-26,Dogecoin Extends Rally as Whale Accumulation Signals Growing Confidence,"The meme cryptocurrency breaks key resistance levels with strong volume, showing resilience as economic uncertainties push investors toward alternative assets.",0.2250887,0.2303115,0.2225032,0.2260962,30970607.30527736,46.961730132238365,0.22552904,0.227610988,
2025-05-26,Discover BYDFi: A user-friendly crypto platform for daily trading,"Crypto platforms love to promise the moon, only to hand you a UI that looks like it was last updated when Dogecoin was a joke and not a movement. Between the confusing fee tables, laggy apps, and KYC processes that..",0.2250887,0.2303115,0.2225032,0.2260962,30970607.30527736,46.961730132238365,0.2256138,0.22731625800000002,
2025-05-27,"Dogecoin, XRP Slump as Crypto Profit-Taking Continues Ahead of Friday's Inflation Data","All eyes are now on this Friday’s Core PCE print, a key inflation gauge for the Federal Reserve, one trading firm noted.",0.2260807,0.23209,0.2198445,0.2260991,66273328.6204669,46.97045415257287,0.22571057,0.227185838,
2025-05-27,Dogecoin Enters Danger Zone — Chartist Predicts Sharp Drop Ahead,Dogecoin slipped toward the lower end of its month-long range on Tuesday as independent chartist Quantum Ascent delivered a granular breakdown of why he believes the meme-coin is part-way through a corrective cascade that could end in the high-teen-cent zone.…,0.2260807,0.23209,0.2198445,0.2260991,66273328.6204669,46.97045415257287,0.22580733999999997,0.22705541800000004,
2025-05-27,Dogecoin Rebounds 5.5% as Whale Accumulation Fuels Bullish Momentum,"Despite market uncertainty and global tensions, DOGE stands out with strong support levels and rising demand from large holders fueling investor interest.",0.2260807,0.23209,0.2198445,0.2260991,66273328.6204669,46.97045415257288,0.22590410999999996,0.226924998,
2025-05-27,"Using XRP to Earn $34,568 a Day Through RichMiner: Dubai Spends $16 Billion to Launch XRP Real Estate Tokenization Platform","This article will focus on the underlying logic of RichMiner's ""passive income.""",0.2260807,0.23209,0.2198445,0.2260991,66273328.6204669,46.97045415257288,0.22600088000000002,0.22679457800000002,
2025-05-27,Dogecoin Breakout Incoming? $3 Target On The Horizon—Analyst,"Dogecoin has held steady above $0.22 since May 20 and climbed back after a brief dip. It hit $0.25 on May 23, then eased into the weekend. In the last 24 hours, the token is up 4.1%. Over a week, it’s up 5%, even though it slipped midweek. Related Reading: XR…",0.2260807,0.23209,0.2198445,0.2260991,66273328.6204669,46.97045415257287,0.22609764999999998,0.226664158,
2025-05-28,Dogecoin Price Breakout To $0.5 Confirmed If It Breaks This Channel Resistance,"Despite its current trading range between $0.22 and $0.23 in the past 48 hours, Dogecoin is still on a noticeable recovery from its April low near $0.13 on a larger time frame. Interestingly, technical analysis of a larger timeframe, particularly the 1-day ca…",0.226085,0.2277362,0.2167322,0.220754,59926354.44911607,32.63773511534542,0.22556343,0.226691472,
2025-05-28,Forget Dogecoin At $1: Price Could Rally To $12 If History Repeats Itself,"Dogecoin has yet to hit its previous $0.74 all-time high from 2021, but nevertheless, $1 has remained the target for the altcoin this cycle. This is due to the expectation of another altcoin season that could send the price on a similar run that was seen in 2…",0.226085,0.2277362,0.2167322,0.220754,59926354.44911607,32.63773511534542,0.22502920999999998,0.226718786,
2025-05-28,"Bitcoin Pulls Back to $107K, but NYDIG Analysis Suggests Market Far From Overheated","A number of indicators suggested the bull market has more room to run, said NYDIG.",0.226085,0.2277362,0.2167322,0.220754,59926354.44911607,32.63773511534542,0.22449499,0.22674609999999998,
2025-05-28,How Will The Dogecoin Price Close Out May? Machine Learning Algorithm Leans Bearish,"The Dogecoin price is in focus as the month draws to a close. The meme coin has already enjoyed a 30% gain so far in May, but this machine learning algorithm suggests that DOGE is unlikely to enjoy further gains until the end of the month.  Machine Learning A…",0.226085,0.2277362,0.2167322,0.220754,59926354.44911607,32.63773511534542,0.22396077,0.22677341400000003,
2025-05-29,Dogecoin Is About To Enter It’s Worst Month In History – Why June Could Be Bloody,"With the month of May drawing to a quick close, it looks like the Dogecoin price is about to end its second month in a row in the green. This has come as a welcome surprise in a month where expectations were that the market would continue to go down. However,…",0.2209636,0.228143,0.2139588,0.2148881,46326073.80830426,22.502205153924677,0.22283996,0.22668341000000003,
2025-05-29,Why Dogecoin Was Slipping on Thursday,,0.2209636,0.228143,0.2139588,0.2148881,46326073.80830426,22.502205153924677,0.22171886000000002,0.22655761600000002,
2025-05-29,Dogecoin Price Forms Inverse Head And Shoulders Pattern To Suggest Quick Reversal To $0.25,"Dogecoin has flipped into negative price territory in a seven-day timeframe, with the meme coin currently down by 6.11% in the past seven days. However, this price action has led to the emergence of a bullish pattern on the 1-hour candlestick timeframe chart.…",0.2209636,0.228143,0.2139588,0.2148881,46326073.80830426,22.502205153924677,0.22059776000000003,0.22643182199999998,
2025-05-30,"Dogecoin Forms Ascending Triangle On Daily Chart, Here’s The Target","Dogecoin (DOGE), the number one meme coin, is making headlines once again, and this time, it’s due to the sudden formation of an Ascending Triangle pattern on its daily chart. This promising technical setup has caught the eye of a crypto analyst, who now fore…",0.2148575,0.2163721,0.190581,0.1935372,151734393.87502924,9.33018627626636,0.21734157,0.22587901,
2025-05-30,"Dogecoin Dives 9%; Cardano’s ADA, SOL Slump 6% as Renewed Tariff Fears Jolt Markets",A fast-moving legal reversal saw the U.S. Court of Appeals for the Federal Circuit issue a temporary stay on Wednesday’s lower court ruling that had struck down the tariffs.,0.2148575,0.2163721,0.190581,0.1935372,151734393.87502924,9.33018627626636,0.21408538,0.225457342,
2025-05-30,"Dogecoin Plunges 10% in Midnight Crash, Struggles to Find Footing","Dogecoin tumbles over 10% in a midnight sell-off, with high trading volumes and a potential double-bottom pattern hinting at possible stabilization.",0.2148575,0.2163721,0.190581,0.1935372,151734393.87502924,9.33018627626636,0.21082918999999997,0.22466525,
2025-05-31,The Next Big Thing In Crypto ETFs? Stablecoin ETFs,"Yield-bearing stablecoin ETF could be the next wave, offering crypto-originated income that is not purely speculative in its own.",0.1934112,0.1956026,0.1855531,0.1925647,114335715.3877882,9.029496761117855,0.20801026,0.223853708,
2025-05-31,"Can Dogecoin Price Still Rally 1,000%? Analyst Reveals End-Of-Year Prediction","A crypto analyst has forecasted a potential 1,000% rally for the Dogecoin price by the end of the year, suggesting that the leading meme coin could not only reach the coveted $1 milestone but blast past it to $2. While this target may seem bold, especially wi…",0.1934112,0.1956026,0.1855531,0.1925647,114335715.3877882,9.029496761117855,0.20519132999999998,0.22304216600000001,
2025-05-31,"Dogecoin Dives 8%, Pepe Down 12% in Weekend Crypto Sell-Off","Cryptocurrencies started the weekend in red with Dogecoin (DOGE) down over 8% to lead losses among majors and Pepe (PEPE) shedding 12%.
Bitcoin fell over 2% to under $104,000 and traded just over $103,600 in Asian afternoon hours Saturday, while the CoinDesk …",0.1934112,0.1956026,0.1855531,0.1925647,114335715.3877882,9.029496761117855,0.2023724,0.22223062400000004,
2025-05-31,"Dogecoin Dives 8%, Pepe Down 12% in Weekend Crypto Sell-Off","Altcoins took a beating as traders digested renewed U.S.-China tariff tensions, Bitcoin whale sell-offs, and a broader risk-off mood.",0.1934112,0.1956026,0.1855531,0.1925647,114335715.3877882,9.029496761117855,0.19955346999999998,0.221592028,
2025-06-01,312 Million Dogecoin Moved To Coinbase – What’s Going On?,"The price action of Dogecoin in the past 48 hours have seen it finally break below the $0.2 mark after a whole week of bullish investors trying to hold above the $0.22 support level. However, this break below the $0.22 support has cascaded into a string of se…",0.1925648,0.1949472,0.1865,0.1937897,112904474.36225636,13.73954059892533,0.19744363,0.220977932,
2025-06-02,Bitcoin and Dogecoin Mining Guide: Make $3000 a Day with XY Miners Cloud Mining,"As the price of the currency continues to rise, the activity of the entire crypto market has also risen.",0.1937719,0.1962843,0.188508,0.1951448,89292094.24768916,18.750979350021552,0.1954693,0.220390938,
2025-06-02,Dogecoin Just Hit Its Final Support—Bulls Have One Last Shot,"Dogecoin begins June balanced on the knife-edge of a major technical fulcrum, its next decisive swing likely to be dictated by a narrow band of support that both Kevin (@Kev_Capital_TA) and Cantonese Cat (@cantonmeow) have brought into sharp relief. Dogecoin …",0.1937719,0.1962843,0.188508,0.1951448,89292094.24768916,18.750979350021552,0.19349497000000002,0.21980394400000003,
